moment,duration,age,race,gender,reflection
Good feeling,Half a day,45-54 years old,Chinese,Female,24 h
everything went smoothly according to plan. no hiccups,A few minutes,55-64 years old,Chinese,Male,24 h
When I managed to completed all my work! ,Half a day,25-34 years old,Chinese,Female,24 h
I received other people praise that I do well in my job,Half a day,35-44 years old,Chinese,Female,24 h
The day my daughter is coming back.,I'm still feeling it,65+ years old,Chinese,Male,24 h
"First moment: One happy moment in the past 24 hours was when I video called my parents who are in Malaysia. 

Second moment: One happy moment in the past 24 hours was when I had lunch with my roommate. ",At least one hour,18-24 years old,Chinese,Male,24 h
go out with my bf ,Half a day,25-34 years old,Chinese,Female,24 h
one happy moment in the past 24 hours was a great meal with family and spending time together,At least one hour,45-54 years old,Chinese,Male,24 h
"My boss allowed us off duty for home due to the following day is a Public Holiday.

",All day,45-54 years old,Chinese,Female,24 h
"One happy moment in the past 24 hours was I spent two hours with my lovers, and my daughter gave me the monthly monetary support. ",I'm still feeling it,55-64 years old,Chinese,Male,24 h
I bought and fix new ceiling fan,I'm still feeling it,55-64 years old,Malay,Male,24 h
When the doctor informed me that my sugar level was at acceptable level.,At least one hour,65+ years old,Indian,Male,24 h
"I had a dinner in a restaurant where friend highly recommended, and very enjoyed with the food.",At least one hour,35-44 years old,Chinese,Female,24 h
"getting out of bed each morning, getting ready for my exercise",At least one hour,65+ years old,Chinese,Female,24 h
one happy moment in the past 24 hours was when my daughter came to my bed to share her edited photographs with me,At least one hour,45-54 years old,Chinese,Female,24 h
Had a good meal at a restaurant,At least one hour,65+ years old,Chinese,Female,24 h
I was happy about my wife sharing ideas,At least one hour,25-34 years old,Malay,Male,24 h
Seeing my family are safe from Covid and healthy from other diseases ,I'm still feeling it,35-44 years old,Chinese,Male,24 h
i reconnected with an old friend hours ago.,I'm still feeling it,35-44 years old,Chinese,Female,24 h
"Cleaning up the house before Hari Raya, feeling fulfilled",At least one hour,35-44 years old,Malay,Female,24 h
My sister says she dreamt of my late husband,A few minutes,55-64 years old,Chinese,Female,24 h
Having  a conversation with my  working collegue.,A few minutes,45-54 years old,Indian,Female,24 h
One happy moment in the past 24 hours was when I was able to leave office at 3.15pm and all my work has been completed.,A few minutes,35-44 years old,Chinese,Female,24 h
"Receiving a sms that reads :  Congratulation , you are the winner to the  free dinner to....",Half a day,65+ years old,Chinese,Male,24 h
I woke up after sleeping for 12 whole hours. ,A few minutes,35-44 years old,Chinese,Female,24 h
swimming makes me happy,At least one hour,35-44 years old,Chinese,Female,24 h
When I woke up this morning and felt that I have a good sleep.,A few minutes,65+ years old,Chinese,Male,24 h
The queue to my favourite food stall was short despite the peak-hours crowd,A few minutes,65+ years old,Chinese,Male,24 h
When i actively engage in voulnteering activities in my neighbourhood.that makes me happy that i help others who needs ,All day,65+ years old,Indian,Male,24 h
"One happy moment in the past 24 hours was when I heard and confirmed that our Govt has decisively shut down the Airport Terminals for 2 weeks (even though it is not 3 weeks that I hope for), to prevent further spreading of Covid-19 Indian Variant into Singapore. ",At least one hour,65+ years old,Chinese,Male,24 h
Adequate family time,All day,65+ years old,Chinese,Male,24 h
I am happy after taking the vaccines as I was well and very confident that it will keep me safe from Covid 19 viruses.,Half a day,65+ years old,Chinese,Female,24 h
One happy moment in the past 24 hours was when we were composing a song with my favourite grandchild.,I'm still feeling it,65+ years old,Malay,Female,24 h
I get food on the table for a meal. ,A few minutes,65+ years old,Chinese,Male,24 h
"One happy moment in the past 24 hours was when I am taking leave, no need to work",Half a day,65+ years old,Chinese,Female,24 h
i see my son hahahaha,At least one hour,65+ years old,Chinese,Male,24 h
Watching a comedy on YouTube ,A few minutes,65+ years old,Chinese,Female,24 h
My grand-daughter prepared breakfast and made dinner for me.,I'm still feeling it,65+ years old,Chinese,Female,24 h
grandchildren interaction and responding to me.,A few minutes,65+ years old,Chinese,Male,24 h
Have a nice sleep after many hours of working ,All day,65+ years old,Chinese,Male,24 h
My brother's wife had her first born,I'm still feeling it,65+ years old,Chinese,Female,24 h
My grandson interacted with me as he has been ignoring me for a long time.,A few minutes,65+ years old,Chinese,Female,24 h
One happy moment in the past 24 hours was when we shared a meal as one happy family.,I'm still feeling it,65+ years old,Malay,Female,24 h
When I had a refreshing drink,A few minutes,65+ years old,Chinese,Female,24 h
I ate a good meal,At least one hour,65+ years old,Chinese,Male,24 h
I managed to share a photo with a humorous message. ,At least one hour,65+ years old,Chinese,Male,24 h
Earn survey reward,All day,,,,24 h
i talkedto my daughter,At least one hour,,,,24 h
My kid visit me and have meal with them.,All day,65+ years old,Chinese,Female,24 h
When my spouse surprised me with an airtime,A few minutes,65+ years old,Chinese,Female,24 h
I completed my hike with my friends and had a opportunity to see the sunrise through the woods.,At least one hour,,,,24 h
"I am happy able to get my broken spectacle frame replaced and use back the existing lens. It's much cheaper compare to making a new one.

   ",I'm still feeling it,,,,24 h
"my neigbour's granddaughter (2 yr old) come by calling me ""auntie""",A few minutes,,,,24 h
Cracked a joke with my youngest son and shared laughter with him. We are seldom serious around each other and share many happy moments. ,A few minutes,,,,24 h
"My entertainment system was set up
",I'm still feeling it,,,,24 h
Seeing pictures and videos of my grandchild,I'm still feeling it,,,,24 h
When i meet my best friend every week,I'm still feeling it,,,,24 h
It was when I got an opportunity to get a phone,A few minutes,,,,24 h
I played computer games with my boyfriend ,At least one hour,,,,24 h
When my team won a game,Half a day,,,,24 h
My food delivery arrived.,A few minutes,,,,24 h
When i joked with my wife.,A few minutes,,,,24 h
"1) I managed to have a deep uninterrupted sleep. I haven’t had that in a while.

2) When I finally managed to eat pizza.",I'm still feeling it,,,,24 h
i having my delicious lunch,At least one hour,65+ years old,Chinese,Female,24 h
Every day when I reach home and saw my 2 dogs cuddling around me and when I see my mum healthy ,At least one hour,,,,24 h
I finally know how to feel loved,I'm still feeling it,,,,24 h
Spending time in botanical gardens.,At least one hour,,,,24 h
"I recently celebrated my birthday with my family members, and a few best friends. We had a great time singing at a karaoke club.",All day,,,,24 h
"I was pleasantly given a surprise by my colleague, a box of delicious cupcakes yesterday. ",I'm still feeling it,,,,24 h
My dog that I bought! ,All day,35-44 years old,Chinese,Male,24 h
Read the my younger daughter ,At least one hour,,,,24 h
One happy moment in the 24 hours was when I get to fuck my girlfriend for 4 rounds.,I'm still feeling it,,,,24 h
I had breakfast with friends this morning.,At least one hour,,,,24 h
Manage to make my own homemade delicious ice cream,All day,,,,24 h
I drank water when I woke up ,A few minutes,,,,24 h
"When someone gave me a bowl of Chinese dessert she bought from the hawker centre nearby, I feel loved",At least one hour,,,,24 h
I pass my skills future course.,I'm still feeling it,,,,24 h
"I had a cup of coppichino one hour ago, the taste was very good and I wasvvery enjoyable...",At least one hour,,,,24 h
when the guy I like kissed me ,All day,,,,24 h
When I took my favourite meal,At least one hour,65+ years old,Chinese,Female,24 h
I woke up today,All day,,,,24 h
No comment on this ,All day,,,,24 h
my children celebrated Mothers Day for me,All day,,,,24 h
My colleague and i had a meaningful talk about our future,At least one hour,,,,24 h
none so far,A few minutes,,,,24 h
no stupid people coming to customer service center,A few minutes,,,,24 h
My husband bought me surprise snacks for mothers day.,At least one hour,,,,24 h
One happy moment in the past 24 hours was when I received a meal from my best friend. He was having his dinner and called me if I had my dinner. I told him I didn't yet have my dinner and he asked me what I want and offered to bring it to me. ,At least one hour,,,,24 h
I am really happy when my wife decided to cook my favorite beef stew today.,I'm still feeling it,,,,24 h
My daughter made and wrote for me a mothers' day card.,I'm still feeling it,,,,24 h
Help a customer of mine ,Half a day,,,,24 h
I am very happy recently because my club just qualified for the champions league final,I'm still feeling it,,,,24 h
I had a fantastic dinner with my family,Half a day,,,,24 h
I have watched a good movie on YouTube. I defeated a pokemon gym and become the new gym leader. ,At least one hour,,,,24 h
no happy moments,Other:,,,,24 h
having an enjoyable meal with family,All day,,,,24 h
negative swab,A few minutes,,,,24 h
"My happy moment in saving money on my broken spectacle frame. I used back my existing lens on the new frame instead of replacing with whole new spectacle costing more.
Saving on fine dinning on last mother's day due to covid-19 restriction on numbers dinner inside the restaurant. We managed  to do a take-away food from eating place near home which lesser cost.",At least one hour,,,,24 h
"When I found out in my drawer that I have an bracelet & an anklet, it has bells on it. I have an obsession with bells. ",At least one hour,,,,24 h
My children ordered food for me on Mother's day. ,All day,,,,24 h
Making new friends in class that I have attended.,I'm still feeling it,,,,24 h
Have dinner,At least one hour,,,,24 h
Treatd my sister to a birthday lunch ,Half a day,,,,24 h
My complaint was heard and changes reverse to normal,At least one hour,,,,24 h
Win money via investment,Half a day,,,,24 h
Times spent with my siblings,All day,,,,24 h
I treated a friend to lunch and cheered her up when she was feeling down,I'm still feeling it,,,,24 h
strike 4D with number that i bought yesterday,All day,,,,24 h
"When i received promotion / bonus letter from my company, in the letter was mention bonus come on April, then follow by Sept 2021!",All day,,,,24 h
did no thave any happy moment,Other:,,,,24 h
When I eat Japanese food,A few minutes,,,,24 h
My marriage,I'm still feeling it,,,,24 h
I have an MC to cover for my drowsiness.,A few minutes,,,,24 h
one happy moment is when my kids gave me a surprise dinner on Mother's Day,At least one hour,,,,24 h
I got the parcel from Shopee which i ordered . ,I'm still feeling it,55-64 years old,Chinese,Female,24 h
I arrange bought flowers into a beautiful floral arrangement for my mum.,Half a day,45-54 years old,Chinese,Female,24 h
it was when my daughter applying powder on my skin when she saw that i was having itchiness on my skin,A few minutes,25-34 years old,Chinese,Female,24 h
One happy moment in the past 24 hours was spending time with my friends where we play an online game together and there were many fun moments.,Half a day,25-34 years old,Chinese,Female,24 h
When my husband auto offers to do an errand for me,A few minutes,25-34 years old,Chinese,Female,24 h
One happy moment in the past 24 hours was when my mum and I were binge watching sitcoms.,At least one hour,35-44 years old,Indian,Female,24 h
One happy moment in the past 24 hours was when I had one of my favourite meals,At least one hour,35-44 years old,Chinese,Female,24 h
We had a meal together as a family. We sang and laughed together ,At least one hour,45-54 years old,Chinese,Female,24 h
I connected with someone with someone at work,Half a day,55-64 years old,Malay,Female,24 h
Thankful that we are coping better with Covid-19 Phase 2 stricter measures this year than 2020.,I'm still feeling it,45-54 years old,Chinese,Female,24 h
Complete my vaccination,A few minutes,45-54 years old,Chinese,Female,24 h
I listened to my favourite song ,I'm still feeling it,18-24 years old,Chinese,Female,24 h
i swe my cats,Half a day,25-34 years old,Malay,Female,24 h
One of my happy moments in the past 24 hours is when I saw my result and I had an A.,I'm still feeling it,25-34 years old,Chinese,Female,24 h
Happy moment for the past 24hrs was listening to my younger daughter reading. I’m so proud of her,At least one hour,35-44 years old,Malay,Female,24 h
my friend made me jelly.,Half a day,45-54 years old,Chinese,Female,24 h
I finished my run.,At least one hour,18-24 years old,Chinese,Female,24 h
"We are going to take flyer, all of us are so excited and enjoy that day.",All day,35-44 years old,Chinese,Female,24 h
my wife cooked my favorite beef stew today,I'm still feeling it,,,,24 h
When I was call up for job interview,A few minutes,,,,24 h
"Could not recall,",All day,,,,24 h
I am happy when I am able to keep company with my elderly mother. I thoroughly enjoy here stories about her childhood days and the times when my and siblings and me were young,All day,,,,24 h
When i  see smile on my parents face ,I'm still feeling it,,,,24 h
I brought a friend out for lunch to cheer her up. ,I'm still feeling it,,,,24 h
My happy moment was being able to talk to my cousin's sister. She is my bestie and mentor ,A few minutes,,,,24 h
there was less traffic jam today,A few minutes,35-44 years old,Chinese,Female,24 h
The survey I did actually make sense.,I'm still feeling it,18-24 years old,Chinese,Female,24 h
My birthday my child gave me a surprise  of buying a cake.,I'm still feeling it,35-44 years old,Chinese,Female,24 h
"My child was born
",I'm still feeling it,65+ years old,Indian,Male,24 h
I slept like a baby ,All day,18-24 years old,Indian,Female,24 h
I bought doge coin and it went up.,I'm still feeling it,25-34 years old,Chinese,Female,24 h
I ate strawberry waffle,At least one hour,25-34 years old,Chinese,Male,24 h
"I am able to solve a problem at home, even though it is not a serious one",A few minutes,45-54 years old,Chinese,Female,24 h
When i secured a job just now. ,I'm still feeling it,25-34 years old,Chinese,Female,24 h
Greg Jeff back off my.,Half a day,25-34 years old,Chinese,Male,24 h
Eating a proper meal,At least one hour,18-24 years old,Indian,Male,24 h
Stay hwalthy,All day,55-64 years old,Chinese,Male,24 h
i worked out yesterday after not working out for a few days,At least one hour,25-34 years old,Chinese,Female,24 h
I was outside petting the community cats in my area,A few minutes,25-34 years old,Chinese,Female,24 h
Rest day. No work.,At least one hour,25-34 years old,Chinese,Male,24 h
I left my workplace.,At least one hour,45-54 years old,Other:,Male,24 h
Cant think of any yet,A few minutes,25-34 years old,Chinese,Female,24 h
Shopping for raya,All day,55-64 years old,Indian,Female,24 h
Enough sleep,Half a day,35-44 years old,Chinese,Female,24 h
I receive a suprise gift from my wife ,At least one hour,35-44 years old,Chinese,Male,24 h
In morning time when i pass time with my son,All day,25-34 years old,Malay,Male,24 h
Having an ice cream ,A few minutes,45-54 years old,Chinese,Female,24 h
I received the certificate for the course I have completed ,Half a day,55-64 years old,Chinese,Male,24 h
"Sales 
I got An offer for the product im selling ",At least one hour,35-44 years old,Chinese,Male,24 h
the couple cook together,Half a day,25-34 years old,Other:,Female,24 h
I can finally go to the beach and enjoy some relaxing time with my wife.,Half a day,25-34 years old,Chinese,Male,24 h
I am blessed by God,All day,45-54 years old,Chinese,Male,24 h
i have food.on my table. physicalfood and spiritual food .,All day,35-44 years old,Chinese,Female,24 h
Completed my morning run,A few minutes,45-54 years old,Chinese,Male,24 h
I watched my favourite variety show,At least one hour,18-24 years old,Chinese,Female,24 h
I cooked for my neighbour ,At least one hour,55-64 years old,Chinese,Male,24 h
Another happy moment in the past 24 hours was when my parents have come over to stay with me,I'm still feeling it,25-34 years old,Malay,Female,24 h
Another is when  job is accomplished.,Half a day,45-54 years old,Chinese,Male,24 h
Another happy moment was when my mum smiled when I wished her happy Mother’s Day ,A few minutes,18-24 years old,Chinese,Female,24 h
I finally managed to get the briyani rice . ,I'm still feeling it,55-64 years old,Malay,Female,24 h
"Relax, carefree, stress-free and do not worry too much. There are a lot of people who are worse off than you",All day,55-64 years old,Chinese,Male,24 h
going to bed,At least one hour,45-54 years old,Chinese,Male,24 h
My second son and daughterc-in-law came visiting with their baby.,I'm still feeling it,65+ years old,Chinese,Male,24 h
I knew I had ample things to entertain me in the near future. ,A few minutes,55-64 years old,Chinese,Male,24 h
Another happy moment in the past 24 hours was when I managed to finish mostly everything I had to do that day before going to bed.,At least one hour,18-24 years old,Chinese,Male,24 h
My sister and i went to market to purchase vegetables,All day,35-44 years old,Chinese,Female,24 h
I found a simple way to have clean and filtered water from the tap.,I'm still feeling it,35-44 years old,Chinese,Female,24 h
Another happy moment in the past 24 hours was when my investment in crypto made money,Half a day,18-24 years old,Chinese,Male,24 h
When my son get hitched in January 2021,I'm still feeling it,45-54 years old,Malay,Female,24 h
I finished my house chores in 1 day,A few minutes,45-54 years old,Chinese,Male,24 h
my colleague requested to move our meeting to the afternoon because she needed more time.  I needed more time too!,I'm still feeling it,55-64 years old,Chinese,Female,24 h
I get to eat my snacks,At least one hour,25-34 years old,Malay,Male,24 h
When I was given surprise of an airtime with my husband,At least one hour,25-34 years old,Chinese,Female,24 h
Enjoying lunch with my wife at home.,At least one hour,55-64 years old,Chinese,Male,24 h
My wife said she love me and thanks me for everything i did to her.,A few minutes,55-64 years old,Chinese,Male,24 h
always feeling Happy,All day,55-64 years old,Chinese,Male,24 h
My children do well.,All day,45-54 years old,Chinese,Female,24 h
I'm happy have 3 children. ,I'm still feeling it,45-54 years old,Chinese,Male,24 h
Praise God,At least one hour,45-54 years old,Chinese,Male,24 h
"Singapore are safe, although there is COVID case increase, I felt proud to be a
Singaporean ",A few minutes,45-54 years old,Chinese,Female,24 h
I managed to cookies baked ,I'm still feeling it,25-34 years old,Malay,Female,24 h
I've a lottery winning. Though it's not a big amount I'm happy because it's been a long time since my last winning ,I'm still feeling it,45-54 years old,Chinese,Male,24 h
"One of my night got a stroke who need help as nobody is around with him at that moment, ",All day,65+ years old,Chinese,Male,24 h
Another happy moment in the past 24 hours was when I received a call from my elder brother. He was checking in on me after I had my vaccination yesterday. I felt happy and loved.,At least one hour,45-54 years old,Chinese,Male,24 h
Another happy moment in the past 24hours when i woke up and saw the photo of BTS again as wallpaper on my phone. 🤣,I'm still feeling it,25-34 years old,Chinese,Male,24 h
yet away from singapore to a less crowded country,I'm still feeling it,45-54 years old,Chinese,Male,24 h
Another happy moment in the past 24 hours was when I watched a good movie,Half a day,18-24 years old,Chinese,Female,24 h
with a suitor,I'm still feeling it,45-54 years old,Chinese,Female,24 h
"No happy moment in the past 24 hours, only thing I can think of is ""sleep well"".",A few minutes,55-64 years old,Chinese,Female,24 h
I have successfully bake a beautiful cake,At least one hour,45-54 years old,Chinese,Female,24 h
When I woke up after a good sleep,All day,55-64 years old,Chinese,Male,24 h
Another happy moment in the past 24 hours was when my husband bought a bouquets of flowers and a box of chocolates to me for our 25th marriage anniversary. ,I'm still feeling it,45-54 years old,Chinese,Female,24 h
Another happy moment in the past 24 hours was when I received my exam results and I did better than I expected.,I'm still feeling it,18-24 years old,Malay,Female,24 h
when i wakeup it my happiest day as i look forward,All day,45-54 years old,Chinese,Male,24 h
when u have fulfilled a task,A few minutes,65+ years old,Chinese,Male,24 h
When I am with my friends ,At least one hour,18-24 years old,Chinese,Female,24 h
Eating with my family,At least one hour,18-24 years old,Chinese,Male,24 h
When I ate a nice supper,A few minutes,25-34 years old,Chinese,Female,24 h
My anime has a new episode ,At least one hour,18-24 years old,Chinese,Male,24 h
Sleeping beside my beloved wife and waking up everyday with the same feeling.,I'm still feeling it,25-34 years old,Chinese,Male,24 h
"For the first time, I bake florentine cookies and it turns out good. ",A few minutes,55-64 years old,Malay,Female,24 h
Another happy moment in the past 24 hours was when I had a good and filling meal.,At least one hour,45-54 years old,Chinese,Male,24 h
Can go home with job done,Half a day,45-54 years old,Chinese,Male,24 h
Another happy moment was when my sister discharged from hospital.and nothing alarming for her health,I'm still feeling it,45-54 years old,Chinese,Female,24 h
"I stepped into my apartment, relieved to be away from the human and road traffic outside",A few minutes,55-64 years old,Chinese,Male,24 h
Spending time with family.,All day,45-54 years old,Chinese,Male,24 h
share joke with friends,A few minutes,55-64 years old,Chinese,Male,24 h
Cooked miso noodles for daughter and she likes it,Half a day,45-54 years old,Chinese,Female,24 h
To achieve the end result of the discussion with client in order to achieve a win win situation ,All day,45-54 years old,Chinese,Male,24 h
Not happy recently quite stress at work,Other:,35-44 years old,Chinese,Female,24 h
Playing with my grand niece,At least one hour,45-54 years old,Chinese,Female,24 h
I was invited to lunch by another member of my church whom I have never had a meal with.,At least one hour,45-54 years old,Chinese,Female,24 h
I have past my test,Half a day,45-54 years old,Chinese,Male,24 h
Brought my parents to Night Safari,Half a day,45-54 years old,Chinese,Female,24 h
"A moment (Sunday) to be close to GOD, praying for HIS Blessing to protect Singapore from this Covid-19 virus, and keeping all Singapore Citizen safe.",I'm still feeling it,55-64 years old,Chinese,Male,24 h
Happy to be able to say i love you to my spouse.,A few minutes,55-64 years old,Chinese,Female,24 h
I ate my favourite chicken rice,All day,55-64 years old,Chinese,Female,24 h
I bought a kitchen appliance at 50 % discount during a Special Promotion Hour where there are limited stocks available ,I'm still feeling it,45-54 years old,Chinese,Female,24 h
Visit my mother in law ,I'm still feeling it,55-64 years old,Chinese,Male,24 h
strike ibet toto $6.,A few minutes,55-64 years old,Chinese,Female,24 h
Customers having confidence & trust me,All day,45-54 years old,Chinese,Female,24 h
That I was able to change my mum's mattress this morning despite the fact that it was my mistake that I ordered wrongly. ,At least one hour,45-54 years old,Chinese,Male,24 h
Another happy moment in the past 24hour was when my parcel is delivered ,A few minutes,18-24 years old,Chinese,Female,24 h
i managed to complete a task assigned.,A few minutes,25-34 years old,Chinese,Male,24 h
No other happy moments.,Other:,45-54 years old,Malay,Male,24 h
another happy moment in the past 24 hours was when my friend surprised me with a dinner treat for my brithday,All day,18-24 years old,Chinese,Male,24 h
Watching movies,At least one hour,45-54 years old,Chinese,Female,24 h
I ate a delicious plate of char kway teow,Half a day,45-54 years old,Chinese,Male,24 h
I managed to win a first place in an online racing video game.,Half a day,25-34 years old,Malay,Male,24 h
Helping my spouse whip up delicious meal for the family. ,Half a day,55-64 years old,Chinese,Male,24 h
it was time for me to sleep. i like lying down in the dark and listening or watching videos on the internet until i fall asleep. i cant sleep otherwise.,A few minutes,18-24 years old,Chinese,Female,24 h
I saw my pet rabbit jumping towards me,At least one hour,45-54 years old,Chinese,Male,24 h
Cannot think of any,Other:,55-64 years old,Chinese,Male,24 h
watch drama which caused me to laugh happily,Other:,45-54 years old,Chinese,Male,24 h
people admire my improved singing talent and achievement,I'm still feeling it,65+ years old,Chinese,Female,24 h
enjoying dinner with my family,At least one hour,18-24 years old,Chinese,Female,24 h
none I can think of,Other:,55-64 years old,Chinese,Male,24 h
I was cooking curry chicken with my mother.,I'm still feeling it,25-34 years old,Malay,Female,24 h
I have manage to walk for 2 hours along changi coastal area to see the beautiful sunset.,I'm still feeling it,55-64 years old,Chinese,Female,24 h
My family members are healthy ,All day,55-64 years old,Chinese,Male,24 h
Making some money on the stock market overseas.,Half a day,55-64 years old,Other:,Male,24 h
My son agreed to our point of view,At least one hour,45-54 years old,Other:,Male,24 h
