moment,duration,age,race,gender,reflection
"One happy moment in the past 3 months was when I celebrated Mother's Day with my family, and I got to see my children and grandchildren in person, together, again.",At least one hour,65+ years old,Chinese,Female,3m
"one happy moment was last week, when i managed to meet up with some old friends and we were talking ",At least one hour,65+ years old,Chinese,Female,3m
"Happy that I retired a month earlier then expected as Company let me go one month earlier.
Celebrated 67 birthday last September",All day,65+ years old,Indian,Male,3m
Medical support,At least one hour,65+ years old,Chinese,Male,3m
first happy moment is realise my dream to retire before the age of 60,I'm still feeling it,65+ years old,Chinese,Female,3m
Celebrate mother's day,Half a day,65+ years old,Chinese,Female,3m
one happy moment was i managed to get a job after almost 2 years of unemployment. ,A few minutes,65+ years old,Chinese,Female,3m
hiking with my friends and family members for one week.,All day,65+ years old,Malay,Female,3m
I smiled when my grand daughter makes me smile ,A few minutes,65+ years old,Chinese,Female,3m
My recent happy moment was when my granddaughter served a (pretend) cup of tea to me last week ,Half a day,65+ years old,Chinese,Male,3m
Having meal outing with family.,All day,65+ years old,Chinese,Male,3m
One happy moment in the past 3 months was when my eldest daughter surprised me with my 67th birthday.,I'm still feeling it,65+ years old,Malay,Female,3m
When went for a retreat at the beach with grandchildren,A few minutes,65+ years old,Chinese,Female,3m
one happy moment in the past 3 months was getting a limited edition lp,All day,65+ years old,Chinese,Male,3m
was able to help a friend to trouble shoot his electrical socket problem and change a electrical switch for him,A few minutes,65+ years old,Chinese,Male,3m
I struck lottery.,All day,65+ years old,Chinese,Male,3m
Dream my lover,I'm still feeling it,,,,3m
Able to rest enough,Half a day,65+ years old,Chinese,Male,3m
practising my GuZheng,All day,65+ years old,Chinese,Female,3m
My cat good service company said they speak english conversations ,Half a day,,,,3m
Being able to take a break from work without having to worry to much about work related issue and spending some free time with myself and friends going out to eat and catch up,All day,,,,3m
Celebrate my birthday with my wife and daughter in law. ,All day,65+ years old,Chinese,Male,3m
Every weekend we have a family gathering either doing things together with all the three generations whether at home or as an outing.,I'm still feeling it,,,,3m
No particular moment that I can really think of at the moment.,A few minutes,,,,3m
Received a belated way belated birthday gift.,A few minutes,,,,3m
One happy moment in the past 3 months was when I received covid-19 vaccination,All day,65+ years old,Malay,Female,3m
"One happy moment in the past 3 months was when i got into the school of my choice. Another one is when my girlfriend and I celebrated our 3 year anniversary
",I'm still feeling it,,,,3m
One moment when somebody just proposed to take the relationship forward when I only knows the person for 1 month,I'm still feeling it,,,,3m
sorry I will give up on this survey.  Feels like doing a comprehension instead.,I'm still feeling it,,,,3m
meeting boyfriend,All day,,,,3m
One happy moment is to know the love of my life ,I'm still feeling it,,,,3m
"Job completed
Earn extra income",All day,,,,3m
Happy when I bought something I like ,A few minutes,,,,3m
I found a job,I'm still feeling it,,,,3m
When my son decided to help me out gardening,All day,,,,3m
One happy moment in the past 3 months was when my husband bring me to cruise holiday,All day,,,,3m
In my birthday month,Half a day,,,,3m
Children unexpected appreciation ,All day,,,,3m
when i got my job,All day,,,,3m
"1) I have a zoom session with all my siblings
2) I got in touch with a friend who I have not met for A very long time",Half a day,,,,3m
i feel happy when i eat,At least one hour,,,,3m
Wife birthday,All day,,,,3m
Help a fallen passenger onboard bus,All day,,,,3m
I had been living with my partner the whole last year. So I had a lot of time to spend with him. Getting to know about him is very challenging. But I am happy of that time,All day,,,,3m
Bake a cake all by myself,Half a day,,,,3m
My son had some problem with one of the subject and I was very worried that he will fail this subject. So about 2 months ago when I was about to go to bed. He came into the room and told me that he managed to pass all his subjects. I was so happy and relieved.,At least one hour,,,,3m
"Before the new phase 2 heightened alert, I had spent amazing quality time with my family and relatives. Had a good food feast and talked a lot.",All day,65+ years old,Malay,Female,3m
Able to spend time at home with my mum during my personal training as my work does not allow me to work from home,At least one hour,,,,3m
I did not experience any happy moment in the last 3 months.,Other:,,,,3m
Went out on an excursion with my good friends.,Half a day,,,,3m
My dog is healthy and happy. ,I'm still feeling it,,,,3m
playing games,At least one hour,,,,3m
I learned to keep a new dish successfully. My family love it and it taste really good.,All day,,,,3m
One happy moment when I went for a long deserved staycation in April,All day,,,,3m
I enjoy eating durian which my husband bought for me last month. It is so delicious.,At least one hour,,,,3m
"First moment: ""One happy moment in the past 3 months was I didn't sleep late so often as compared to the past.""

Second moment:""I'm happy that I'm no longer have the habits that I used to have in the past.",I'm still feeling it,,,,3m
Started my indoor garden and harvest successfully. ,I'm still feeling it,,,,3m
Celebrating my wife birthday,All day,,,,3m
One happy moment was when I took my family out for a vacation outside the city to far places,All day,,,,3m
When I had a visit to the beach,At least one hour,65+ years old,Malay,Female,3m
No happy moments at all. ,Other:,,,,3m
My babies happiness ,Half a day,,,,3m
I got new part time work for 1 mth.,Half a day,,,,3m
"I can't remember the last time I was happy. I keep a slight smile on my face but my thoughts as they always were, they were empty. I was and am still empty.",Other:,,,,3m
"I was very touched and proud of my grandson for taking the initiative of buying packets of Milo from school for me, his grandfather and his great-grandmother. ",At least one hour,65+ years old,Chinese,Female,3m
When my parcel arrived.,Half a day,,,,3m
I taught myself how to use Photoshop to improve the quality of our photos and graphics. I soon became the go-to person for any design needs.,All day,,,,3m
Fhhfhhrruk,I'm still feeling it,65+ years old,Chinese,Female,3m
When my grandchildren express their love for me ,Half a day,,,,3m
When I realised and felt a new found hope and confidence in trying to secure a better future,I'm still feeling it,,,,3m
I was happy when my child was kind and considerate. ,A few minutes,,,,3m
I buy a new house,At least one hour,,,,3m
"My exams finally ended and I'm going to second year of university. 
Found a part time job. ",Half a day,,,,3m
Content and safe,Half a day,,,,3m
going out with someone i love ,All day,,,,3m
i kiss my good friend,A few minutes,,,,3m
LOOKING FORWARD TO MY RETIREMENT ,All day,,,,3m
Happyhdjzkxhzkkxncnzjzk.&39:&;&;9;,At least one hour,,,,3m
One happy moment in the past 3 months is the joy of seeing and cuddling my stuff toys.,I'm still feeling it,,,,3m
"One happy moment in the past 3 months was when we have dinner together at home for Mother's day 9 May, where my sons and daughters bought gifts for me and really nice vegetarian dishes for us all to enjoy.",Half a day,65+ years old,Chinese,Female,3m
i did fairly well in my tests after studying hard,Half a day,,,,3m
"I love being with my godsons and having a fun time with them, like shopping and watching 'Just for Laughs'.",A few minutes,,,,3m
I am happy  went  I get angry ,At least one hour,,,,3m
I managed to protect my car from dents and scratches with PPE,Half a day,,,,3m
That I have completed my final module for my part time degree,All day,,,,3m
That feeling did not happen.,Other:,,,,3m
The feeling was good when someone proposed to take the relationship forward,I'm still feeling it,65+ years old,Chinese,Female,3m
my 8 year old grandsontold us that he wouldcome come and stay with us as now we can have only 2 guests per household and his other cousin could cometoo.Children are so innocent .to them evrything is possible aslong as they get to play and be together.,I'm still feeling it,65+ years old,Indian,Female,3m
When playing with the cat,At least one hour,,,,3m
As usual. Don't really particular as long as healthy and peace in life.,Other:,,,,3m
One happy moment in the past 3 months was when my husband ordered me a very good lunch during my birthday.,Half a day,,,,3m
"First moment was when I was told by my boss that she is prompting me to be a Manager. To me that is a huge recognition to the hard work that I have put in all these years.
Second moment was when during my medical appointment when doctor told me my cholesterol level has dropped to normal range and it has to do with my diet and my health lifestyle ",I'm still feeling it,,,,3m
nothing. Happiness is transient. Fulfillment is more important,Other:,,,,3m
I do not have any happy moments for the past 3 months,I'm still feeling it,,,,3m
Getting a big pay check,All day,,,,3m
"I received bonus from my employer in midst of pandemic. (Am in construction industry)
",Half a day,55-64 years old,Chinese,Female,3m
i am happy as my mom better from sick ,All day,55-64 years old,Chinese,Female,3m
When I felt respected by my neighbours,All day,55-64 years old,Chinese,Female,3m
my daughter got full marks for her science test,I'm still feeling it,35-44 years old,Chinese,Female,3m
being able to work from home,Half a day,25-34 years old,Chinese,Female,3m
"1. When i gave birth to my son.
2. My parents gave me all the scarification ",I'm still feeling it,25-34 years old,Chinese,Female,3m
I quitted my job,I'm still feeling it,35-44 years old,Chinese,Female,3m
My girl told me she loves covid 19 because she can do hbl,I'm still feeling it,35-44 years old,Chinese,Female,3m
One happy moment in the past 3 months was when I received a huge reward from my boss. The company gave me bonus $5k for reward me as a loyalty staff.,Half a day,25-34 years old,Chinese,Female,3m
When all my debts are paid off,A few minutes,25-34 years old,Chinese,Female,3m
For mother's day my daughter made me a bottle of my favourite chocolate cookies and this makes my day. I am also happy when my hubby spend time with me to have a meal at the hawker centre.,All day,45-54 years old,Chinese,Female,3m
I hit my sales target and also achieved a sell-out,Half a day,45-54 years old,Chinese,Female,3m
One happy moment in the past 3 months was when I got the news that I was offered a job for my summer holiday,All day,18-24 years old,Chinese,Female,3m
When I get to bought a new bag.,All day,35-44 years old,Malay,Female,3m
"i did a presentation by myself for work and i got recognition by my manager and a senior, who said that it was a very good presentation.",At least one hour,18-24 years old,Chinese,Female,3m
living the moment of happiness ,A few minutes,35-44 years old,Chinese,Female,3m
My son treating me to a nice mother's day lunch,Half a day,,,,3m
My birthday celebration,All day,,,,3m
i am able to work from home,All day,,,,3m
Plan to have my COVID-19 vaccine to protect my family and myself.,I'm still feeling it,,,,3m
Bear the longest period and finally let go,At least one hour,25-34 years old,Chinese,Male,3m
I can meet up my old friend that I remembered.,Half a day,35-44 years old,Chinese,Female,3m
Being able to get driving license,Half a day,18-24 years old,Chinese,Male,3m
Having home cook meal,Half a day,25-34 years old,Chinese,Female,3m
when My son on second diagnosis was cleared of a seroius illness,All day,45-54 years old,Chinese,Male,3m
Happy that I can buy a ofter TV which I aim for long time,Half a day,65+ years old,Chinese,Male,3m
I got my certificate ,All day,35-44 years old,Chinese,Male,3m
Another happy moment was to having outing with my friends,All day,55-64 years old,Chinese,Female,3m
"Get together will my old friends,finally",All day,35-44 years old,Malay,Male,3m
Another happy moment in the past 3 months was when we launched the Free Store and Feeding Program which our Church was the spearhead.,I'm still feeling it,35-44 years old,Other:,Female,3m
Another happy moment in the past 3 months was when my birthday celebration.,Half a day,25-34 years old,Malay,Female,3m
When have help to my friend ,I'm still feeling it,35-44 years old,Malay,Female,3m
To be a mother of my child,All day,25-34 years old,Malay,Female,3m
I have time to myself to cleanup my house,At least one hour,35-44 years old,Chinese,Female,3m
Relax at home,Half a day,45-54 years old,Chinese,Female,3m
Got to have a public holiday to rest,Half a day,35-44 years old,Chinese,Male,3m
"Ccelebrating birthday party, wat,drink, gathering ",Half a day,55-64 years old,Chinese,Male,3m
I have no other liabilities for the day.,At least one hour,35-44 years old,Chinese,Male,3m
Birthday of my child,I'm still feeling it,35-44 years old,Chinese,Male,3m
celebration of wife birthday,Half a day,45-54 years old,Chinese,Male,3m
The day when 1st daughter was borned,All day,45-54 years old,Chinese,Male,3m
Nothing seems to been in place for me to feel happy about,A few minutes,55-64 years old,Chinese,Male,3m
I went sentosa beach with my friends,All day,25-34 years old,Chinese,Male,3m
Another happy moment in the past 3 months was when i purchase a new phone,All day,18-24 years old,Chinese,Male,3m
Another happy moment was when I received a new iPhone as a present.,A few minutes,45-54 years old,Chinese,Male,3m
My son completed the full Covid vaccination without adverse effects.,I'm still feeling it,55-64 years old,Chinese,Male,3m
"I finally had  my well deserved break,  able to nap.",At least one hour,35-44 years old,Chinese,Female,3m
Nothing in particular during this period where I'm extremely happy about.,A few minutes,55-64 years old,Chinese,Male,3m
Read an interesting article about my idol. Very insightful and kind of funny,A few minutes,45-54 years old,Chinese,Female,3m
"Unfortunately, nothing made me happy in the last 3 months",Other:,35-44 years old,Chinese,Female,3m
Got gifts for Mother’s Day from children  ,All day,45-54 years old,Chinese,Female,3m
He buy us a meal,All day,55-64 years old,Chinese,Male,3m
good time for my life ,Half a day,25-34 years old,Malay,Male,3m
When I decided the direction I will want to go forward.,At least one hour,45-54 years old,Chinese,Male,3m
Receive a call from long loss friend via phone.,I'm still feeling it,65+ years old,Chinese,Male,3m
My elder son managed to get into polytechnic,All day,45-54 years old,Chinese,Male,3m
Spending time with family,At least one hour,25-34 years old,Chinese,Female,3m
Spent another quality time with my wife ,Half a day,45-54 years old,Chinese,Male,3m
Changing jobs,Half a day,35-44 years old,Chinese,Male,3m
Another happy moments was when my daughter performed very well in her examination.,All day,45-54 years old,Chinese,Male,3m
Another happy moment would be when I was able to play mahjong and socialize with my friends whom I have not for quite some time,Half a day,18-24 years old,Chinese,Male,3m
Eating my favourite food,At least one hour,55-64 years old,Chinese,Male,3m
When I was able to have the time to actually watch Netflix.,A few minutes,45-54 years old,Chinese,Male,3m
Another happy moment in the past 3 months was when I was discussing the date to go ROM with my boyfriend.,A few minutes,25-34 years old,Chinese,Female,3m
keeping my job,I'm still feeling it,45-54 years old,Chinese,Male,3m
Another happy moment was when my boyfriend reassured my insecurities that I felt at the moment. ,I'm still feeling it,18-24 years old,Malay,Female,3m
I  donated to the poor,All day,55-64 years old,Malay,Male,3m
I am happy when my family is safe ,At least one hour,45-54 years old,Chinese,Female,3m
I get to hike and experience nature for a short while.,Half a day,18-24 years old,Chinese,Female,3m
Another happy moment was when I finally was able to try my favourite food after such a long time. ,At least one hour,45-54 years old,Chinese,Male,3m
Another happy moment is that I resumed by first 3 hours walk... it's has been a while for such luxury exercise session,All day,55-64 years old,Chinese,Female,3m
I got a good recipe,A few minutes,45-54 years old,Chinese,Female,3m
Another happy moment was when my younger daughter started to open up to me about her thoughts and feelings after being quiet for a year or so.  This happened about 3 weeks ago.,I'm still feeling it,45-54 years old,Chinese,Male,3m
Another happy moment in the past 3 months was when my son is so thoughtful seeing my leg is hurt and he actually ask me to sit down n massage me. ,I'm still feeling it,35-44 years old,Chinese,Female,3m
it is finally good friday so i get a long weekend,All day,45-54 years old,Chinese,Male,3m
when I am free from loan payments,I'm still feeling it,55-64 years old,Indian,Male,3m
I had a family meal together after a long time.,Half a day,65+ years old,Malay,Male,3m
"I cook for my children they happily finish up all, that is my happiness.",All day,45-54 years old,Chinese,Female,3m
Opened a business ,I'm still feeling it,55-64 years old,Indian,Male,3m
getting to know new people,A few minutes,45-54 years old,Chinese,Male,3m
I won $500 in a lottery,All day,55-64 years old,Chinese,Female,3m
Still healthy makes me happy every moment.,I'm still feeling it,45-54 years old,Chinese,Female,3m
Going to eat with my parents yesterday as it was mother day we had lots of fun and foof was very good too,I'm still feeling it,18-24 years old,Chinese,Male,3m
One of my endowment plan matured,All day,55-64 years old,Chinese,Female,3m
another happy moment was when i spent time with friends ,At least one hour,25-34 years old,Chinese,Female,3m
Someone at my household won a 4D(Lottery),At least one hour,45-54 years old,Chinese,Male,3m
no troubles that bother me.,At least one hour,35-44 years old,Chinese,Male,3m
Gotten my first order from customer on setting up my own business ,All day,45-54 years old,Chinese,Male,3m
"When the dentist talked to my son"" there is no need to remove the wisdom tooth at the moment, let's monitor its growth and check up in one year's time""",I'm still feeling it,45-54 years old,Chinese,Female,3m
Have a meal with my family,At least one hour,45-54 years old,Chinese,Female,3m
I finally managed to get reservations at some coveted places I wanted to dine at!,All day,45-54 years old,Chinese,Female,3m
More people in the world benefit from coving jabs,Half a day,45-54 years old,Chinese,Male,3m
I make profit from stock marketeven at bad time. ,All day,45-54 years old,Chinese,Male,3m
I did aome charity donations to help senior citizen. ,I'm still feeling it,45-54 years old,Malay,Male,3m
Another happy moment in the past 3 months was when I gave a hand of help to stranger and he really appreciated.,I'm still feeling it,25-34 years old,Malay,Female,3m
House cleaning completed,At least one hour,55-64 years old,Chinese,Female,3m
When I get to do things my way and be free,All day,18-24 years old,Chinese,Male,3m
walking in a park,At least one hour,45-54 years old,Chinese,Female,3m
Staycation at Pan Pacific Hotel,I'm still feeling it,55-64 years old,Chinese,Female,3m
my kids making me happy ,All day,25-34 years old,Chinese,Female,3m
Staycation with my spouse and family of my elder son.,I'm still feeling it,65+ years old,Chinese,Male,3m
my income improve despite tough conditions of Covid19,I'm still feeling it,45-54 years old,Chinese,Male,3m
Things all goes well,A few minutes,45-54 years old,Chinese,Male,3m
We went to take Seafood dinner in a restaurant. I enjoy eating seafood.,I'm still feeling it,55-64 years old,Chinese,Female,3m
Another happy moment is to appreciate the journey of taking public transport since April 2021 as advised by my doctor not to drive temporarily after having driven for the past 40 years.,I'm still feeling it,55-64 years old,Chinese,Male,3m
The second was when I had a constructive intellectual discourse with an old friend.,Half a day,65+ years old,Chinese,Male,3m
None that I could remember.,A few minutes,55-64 years old,Chinese,Male,3m
I went shopping and bought things for myself.,All day,55-64 years old,Chinese,Female,3m
Another happy moment is my daughter graduation from her university qualification.,All day,55-64 years old,Chinese,Male,3m
Another happy moment in the past 3 months was when I finally submitted my assignment.,Half a day,18-24 years old,Chinese,Female,3m
The high mortality from the COVID -19 means a more conducive living environment.,I'm still feeling it,45-54 years old,Chinese,Male,3m
Went on cruise with my loved one. ,I'm still feeling it,55-64 years old,Chinese,Female,3m
My foot ball team won ,I'm still feeling it,25-34 years old,Chinese,Female,3m
In the past one week.,All day,35-44 years old,Chinese,Male,3m
Another happy moment is I meet up with friends whom I have not met for a long time.,Half a day,45-54 years old,Chinese,Male,3m
there is none recent happy moment i can recall ,A few minutes,45-54 years old,Chinese,Female,3m
No comment ,Half a day,55-64 years old,Chinese,Male,3m
When my daughter celebrated mother's day of her own cognizance,A few minutes,55-64 years old,Chinese,Male,3m
When I had the opportunity to have alcohol,At least one hour,18-24 years old,Chinese,Male,3m
Received SMS from HDB purchase BTO queue number.,I'm still feeling it,45-54 years old,Chinese,Male,3m
"Sometime last month, my friends and I had a good time at sentosa after the long covid pandemic",I'm still feeling it,55-64 years old,Chinese,Female,3m
"Got inheritance from late father,  able to retire early",I'm still feeling it,55-64 years old,Chinese,Male,3m
I bring my 3 years old grand daughter to the swimming pool in my condo estate. She loves playing in water like most kids.  You can see the joy in their face and smiles.,At least one hour,65+ years old,Chinese,Male,3m
I'm always hanging out with my friends,Half a day,55-64 years old,Malay,Male,3m
I strike lottery,All day,45-54 years old,Chinese,Male,3m
When I am able to run for a long time after being scolded as fat and that I also did not have the time to exercise,Half a day,25-34 years old,Chinese,Male,3m
I am happy when I watch variety shows that makes me laugh.,At least one hour,18-24 years old,Chinese,Male,3m
My son look to me for advice for the first time since his teenage.,I'm still feeling it,55-64 years old,Chinese,Male,3m
The other happy moment is when I was able to watch a kdrama that I have been wanting to watch.,I'm still feeling it,55-64 years old,Chinese,Male,3m
my son climbed into bed with me and hugged me to sleep,All day,45-54 years old,Chinese,Female,3m
Having meals together with family.,All day,65+ years old,Chinese,Female,3m
another happt moment is when i get recognised by my boss,At least one hour,25-34 years old,Chinese,Female,3m
Achieve my personal goal by doing certain amount of exercise ,All day,45-54 years old,Chinese,Female,3m
Having a business dinner with an investors,I'm still feeling it,35-44 years old,Malay,Male,3m
The second moment was when the family went on a staycation and we do not need to worry about work.,All day,25-34 years old,Chinese,Male,3m
We go into phrase 3 of lock down.  Good to be able see my friends and families again. ,I'm still feeling it,55-64 years old,Chinese,Female,3m
Gathering with family members for a good meal,I'm still feeling it,45-54 years old,Chinese,Female,3m
"seeing both my children sharing their love, ideas, and thoughts- brotherhood which is something very special- more than bonding",I'm still feeling it,55-64 years old,Chinese,Female,3m
i finish a project,A few minutes,45-54 years old,Chinese,Male,3m
I was able to help our community club to organize free tutorial class for children who cannot afford tuition classes.,At least one hour,65+ years old,Chinese,Male,3m
Another happy moment is when no one stress me at the company,Half a day,45-54 years old,Chinese,Female,3m
Another happy moment in the past 3 months was when I prepared a traditional meal and everyone was enjoying the meal.,All day,25-34 years old,Malay,Female,3m
"Last Wednesday when I had a good round of gold.  I played well and after the game, I met some guys which I have not seen for years.  ",Half a day,55-64 years old,Chinese,Male,3m
Second moment as when I managed to complete a task together with the team under me. ,All day,25-34 years old,Chinese,Male,3m
I have eaten the veggies that I grew in my hydroponic system,I'm still feeling it,55-64 years old,Chinese,Male,3m
Lucky draw,All day,55-64 years old,Chinese,Female,3m
I went out with good friend,Half a day,45-54 years old,Chinese,Male,3m
When I get my new salary after being retrenched ,All day,25-34 years old,Chinese,Female,3m
It was when I gave a spare mask to someone who forgot to put on the mask at a bus stop.,A few minutes,55-64 years old,Chinese,Male,3m
My daughter birthday ,At least one hour,55-64 years old,Chinese,Female,3m
"Another moment would be when I know i finished another term in SCS, also felt real nice.",I'm still feeling it,18-24 years old,Chinese,Male,3m
no happy moment,Other:,55-64 years old,Chinese,Female,3m
Was at my friend's house who just gotten a puppy.,I'm still feeling it,55-64 years old,Chinese,Female,3m
When I went on my honeymoon to Japan with my wife in 2016. ,Other:,25-34 years old,Chinese,Male,3m
I went to the zoo after years. ,All day,18-24 years old,Chinese,Female,3m
I don't generally have this kind of moments cause I am happy all the time.,Other:,55-64 years old,Chinese,Male,3m
