moment,duration,age,race,gender,reflection
Another happy moment in the past 24 hours was when I take a shower with music I love,A few minutes,25-34 years old,Chinese,Male,24 h
Another happy moment in the past 24 hours was when I play with my child at night,A few minutes,25-34 years old,Chinese,Male,24 h
My salary got increased,Half a day,35-44 years old,Indian,Male,24 h
When I see my investment appreciation ,Half a day,35-44 years old,Chinese,Male,24 h
I ate nice food that my mom brought back,A few minutes,25-34 years old,Chinese,Female,24 h
Another moment when I was happy was that my spouse bought me food that I really liked,At least one hour,25-34 years old,Chinese,Female,24 h
Don’t have any.,A few minutes,65+ years old,Chinese,Female,24 h
I finished my days activities,At least one hour,25-34 years old,Malay,Female,24 h
Eating dinner,At least one hour,25-34 years old,Chinese,Female,24 h
Another happy moment in the past 24 hours was when I have done my errands without procrastination.,At least one hour,25-34 years old,Chinese,Male,24 h
Actually I just get happy when people I care about message me so yep when I got texted by my close friends!,Half a day,18-24 years old,Chinese,Female,24 h
Showered and washed my hair.,At least one hour,18-24 years old,Chinese,Female,24 h
I am having my dinner,At least one hour,35-44 years old,Chinese,Male,24 h
I finished cleaning the house. The feeling of satisfaction of  a clean house. ,At least one hour,25-34 years old,Chinese,Male,24 h
i had a good run outdoor with a great timing to boot.,At least one hour,35-44 years old,Chinese,Male,24 h
Another happy moment in the past 24 hours was when I have a good meal,A few minutes,25-34 years old,Chinese,Male,24 h
Getting a job,I'm still feeling it,35-44 years old,Chinese,Female,24 h
My close friends wanted to arrange a group video chat later this week,A few minutes,25-34 years old,Chinese,Female,24 h
I felt happy in the past 24 hours when I received a bouquet. ,At least one hour,25-34 years old,Chinese,Female,24 h
Another happy moment in the past 24 hours was when I come home ,A few minutes,25-34 years old,Chinese,Male,24 h
Is thet people dont have to pretend,Half a day,35-44 years old,Indian,Male,24 h
"My meeting went well, my proposal accepted",At least one hour,35-44 years old,Chinese,Female,24 h
I exercised and worked out after eating,At least one hour,18-24 years old,Chinese,Female,24 h
I watched a livestream with my favourite music artist.,I'm still feeling it,18-24 years old,Other:,Female,24 h
another happy moment was when i got to go home early,At least one hour,25-34 years old,Chinese,Male,24 h
Cracking jokes in whatsapp message,At least one hour,35-44 years old,Indian,Female,24 h
i am able to get in bed earlier than other days,At least one hour,25-34 years old,Chinese,Male,24 h
Happy for yesterday i got my new Samsung phone,Half a day,35-44 years old,Chinese,Male,24 h
another happy moment in the past 24 hours was when i had a delicious chicken pie. ,A few minutes,25-34 years old,Chinese,Prefer not to say,24 h
My friend called me not so long ago and commented that I look so young for my age. That really made my day!,I'm still feeling it,65+ years old,Chinese,Female,24 h
i have fun doing my job teaching children english,At least one hour,25-34 years old,Chinese,Female,24 h
when receive money from other people,Half a day,25-34 years old,Malay,Female,24 h
I had my dinner,At least one hour,25-34 years old,Chinese,Male,24 h
"just 34 hours ago, i was compensated for my damaged car.",Half a day,35-44 years old,Chinese,Female,24 h
dont have anyy,Half a day,18-24 years old,Chinese,Female,24 h
I opened a domiciliary account successfully. ,All day,35-44 years old,Malay,Male,24 h
House Renovation is going to underway ,I'm still feeling it,35-44 years old,Chinese,Male,24 h
"surprizing my mom, give some gift",All day,25-34 years old,Other:,Male,24 h
I had an enjoyable dinner with my friends.,A few minutes,18-24 years old,Chinese,Female,24 h
Another of my happy moment is when I graduated from University and achieve my University degree.,I'm still feeling it,25-34 years old,Malay,Male,24 h
I ran for the bus and the bus stopped for me so I don't miss it.,A few minutes,18-24 years old,Malay,Female,24 h
Seeing my mother,All day,35-44 years old,Chinese,Male,24 h
Ate mentaiko fries because I wanted to eat it for a really really long time,I'm still feeling it,18-24 years old,Chinese,Female,24 h
Enjoying my lunch,A few minutes,35-44 years old,Chinese,Male,24 h
"I set myself a target to complete an exercise regime based on frequency, timing and no. of sets and I was able to achieve it ",At least one hour,65+ years old,Chinese,Male,24 h
My daughter passed me her salary,A few minutes,65+ years old,Chinese,Female,24 h
My next happy moment was when I made my coffee for breakfast,At least one hour,25-34 years old,Chinese,Male,24 h
Thinking about my family. We have a wonderful dinner to celebrate post mother's day celebration. ,I'm still feeling it,35-44 years old,Chinese,Female,24 h
I received a notification that I will received $800 this 15th May from the SSO that I applied last month. ,I'm still feeling it,25-34 years old,Other:,Female,24 h
Having homemade pasta,A few minutes,35-44 years old,Chinese,Male,24 h
i called up one of my customers and he responded positively,A few minutes,35-44 years old,Chinese,Female,24 h
my mother's health is getting stable ,A few minutes,35-44 years old,Chinese,Male,24 h
i completed the work day without any issues,A few minutes,35-44 years old,Chinese,Male,24 h
The day i met my girlfriend,I'm still feeling it,18-24 years old,Chinese,Male,24 h
Being able to translate a japanese tweet by myself without the use of google translate,A few minutes,18-24 years old,Chinese,Non-binary / third gender,24 h
Getting my first employment ,All day,35-44 years old,Indian,Female,24 h
Nothing. I was very busy once again. And I have to work ,A few minutes,35-44 years old,Chinese,Male,24 h
Another moment is when i was able to eat at my favourite restaurant,At least one hour,18-24 years old,Indian,Female,24 h
a fried sent me a large amount of money.,I'm still feeling it,35-44 years old,Chinese,Female,24 h
"Completion of a tedious research work, as mentioned previously by mistake",A few minutes,18-24 years old,Chinese,Male,24 h
Able to have own space to watch my favourite shows ,At least one hour,35-44 years old,Chinese,Female,24 h
A good sushi meal,Half a day,65+ years old,Chinese,Female,24 h
at the workplace ,All day,65+ years old,Chinese,Male,24 h
another happy moment in the past 24 hours was when i helped my mother to clean the kitchen and we did a good job with it,I'm still feeling it,18-24 years old,Malay,Female,24 h
Nothing in particular ,A few minutes,18-24 years old,Malay,Female,24 h
My grandchildren insisted I play indoor games with them ,Half a day,65+ years old,Indian,Male,24 h
Another happy moment in the past 24 hours was when my team leader complimented me on my project ideas. ,At least one hour,18-24 years old,Malay,Female,24 h
Catching up with some friends,At least one hour,18-24 years old,Chinese,Female,24 h
Another happy moment in the past 24 hours was when I talked to my online friends.,At least one hour,18-24 years old,Chinese,Female,24 h
I get to eat nice and affordable food.,All day,18-24 years old,Chinese,Female,24 h
when we eat as family,Half a day,,,,24 h
Talk to the person close to me,All day,,,,24 h
I was able to switch on the air-conditioning because it was a hot night.,At least one hour,,,,24 h
sleeping for a long hours,Half a day,18-24 years old,Chinese,Female,24 h
Another happy moment in the past 24 hours was when I got to play some childhood toys and reminisce with my family while cleaning the house,At least one hour,18-24 years old,Malay,Non-binary / third gender,24 h
My granddaughter gave a intelligent answer to my question.,All day,65+ years old,Chinese,Female,24 h
The soup I made for dinner turned out well!,At least one hour,25-34 years old,Chinese,Female,24 h
Finish paying for our house mortgage,I'm still feeling it,55-64 years old,Chinese,Female,24 h
Another happy moment in the past 24 hours was when I got confirmed orders.,Half a day,25-34 years old,Malay,Female,24 h
Good feeling,Half a day,45-54 years old,Chinese,Female,24 h
i was able to get the reward i wanted for playing a game,A few minutes,55-64 years old,Chinese,Male,24 h
I managed to have home cooked food by my mum ,I'm still feeling it,25-34 years old,Chinese,Female,24 h
I help other people,All day,35-44 years old,Chinese,Female,24 h
When I found some drama for my partner.,All day,65+ years old,Chinese,Male,24 h
"Second moment: ""Another happy moment in the past 24 hours was when I had lunch with my roommate. ",At least one hour,18-24 years old,Chinese,Male,24 h
having sex,All day,25-34 years old,Chinese,Female,24 h
another happy moment in the past 24 hours was when i watched an awesome documentary show with my wife.,At least one hour,45-54 years old,Chinese,Male,24 h
I have confirmed one potential candidate who is willing to join the company which I am helping to do the recruitment.,I'm still feeling it,45-54 years old,Chinese,Female,24 h
my daughter gave me the monthly monetary support to family expenses,I'm still feeling it,55-64 years old,Chinese,Male,24 h
Celebrating HARI raya,I'm still feeling it,55-64 years old,Malay,Male,24 h
When my son found a new job.,All day,65+ years old,Indian,Male,24 h
My colleague recommended a new drama which is quite interesting ,A few minutes,35-44 years old,Chinese,Female,24 h
"indulge in my hobby, playing my GuZheng",All day,65+ years old,Chinese,Female,24 h
another happy moment in the past 24 hors was when i did my yoga exercise while freeing my mind ,At least one hour,45-54 years old,Chinese,Female,24 h
Having an enjoyable time practicing Taiji with my friends,At least one hour,65+ years old,Chinese,Female,24 h
I was happy about how successful I'm becoming each day,Half a day,25-34 years old,Malay,Male,24 h
I made extra money in stock market,All day,35-44 years old,Chinese,Male,24 h
i eat my favorite meal.,All day,35-44 years old,Chinese,Female,24 h
Having a good fudge chocolatey brownie,A few minutes,35-44 years old,Malay,Female,24 h
My 80 yr old mom finished her meal,A few minutes,55-64 years old,Chinese,Female,24 h
Having conversation with my children.,At least one hour,45-54 years old,Indian,Female,24 h
Another happy moment in the past 24 hours was when I was able to sleep past 8 amand had uninterrupted sleep for 10 hours.,A few minutes,35-44 years old,Chinese,Female,24 h
A friend called to collect some freebies from a shop on promotion,A few minutes,65+ years old,Chinese,Male,24 h
I goodnight kissed my husband. ,A few minutes,35-44 years old,Chinese,Female,24 h
i whatsapp chatted with a friend,At least one hour,35-44 years old,Chinese,Female,24 h
When I received an email asking if I can provide my company's services to one client.,At least one hour,65+ years old,Chinese,Male,24 h
I made a decision to stay at home and it rained almost immediately after,A few minutes,65+ years old,Chinese,Male,24 h
My granddaughter fully recovered,At least one hour,65+ years old,Indian,Male,24 h
"Another happy moment in the past 24 hours was when I was sharing the wished for events that had happened to my family, relatives and friends. ",A few minutes,65+ years old,Chinese,Male,24 h
Family gather ,All day,65+ years old,Chinese,Male,24 h
I was very happy that our country will be going from Phase 2 to 1 last month.  We were going to open up and the economy will be better.,At least one hour,65+ years old,Chinese,Female,24 h
Another happy moment in the past 24 hours was when I prepared traditional meal and all family members enjoyed the meal.,I'm still feeling it,65+ years old,Malay,Female,24 h
A sudden downpour that cools the weather. ,At least one hour,65+ years old,Chinese,Male,24 h
Another happy moment in the past 24 hours was when I am watching TV,I'm still feeling it,65+ years old,Chinese,Female,24 h
SEE MY WIFE!~,All day,65+ years old,Chinese,Male,24 h
I eating out for dinner,At least one hour,65+ years old,Chinese,Female,24 h
Relaxing and watching dramas after dinner.,I'm still feeling it,65+ years old,Chinese,Female,24 h
enjoying nice and delicious food.,A few minutes,65+ years old,Chinese,Male,24 h
I feel so refreshing after a good rest ,I'm still feeling it,65+ years old,Chinese,Male,24 h
My friend was having a wedding,All day,65+ years old,Chinese,Female,24 h
I cook my own meal and choose the ingredients i like to eat.,A few minutes,65+ years old,Chinese,Female,24 h
Another happy moment in the past 24 hours was when we were preparing dinner.,I'm still feeling it,65+ years old,Malay,Female,24 h
When we went for swimming,At least one hour,65+ years old,Chinese,Female,24 h
I had a good night's sleep and woke up feeling energetic,At least one hour,65+ years old,Chinese,Male,24 h
I came across a clip on the US china relations. ,A few minutes,65+ years old,Chinese,Male,24 h
Birthday party on last year,All day,,,,24 h
self realization,At least one hour,,,,24 h
My kid got a new job.,Half a day,65+ years old,Chinese,Female,24 h
When I met my chemistry teacher online,At least one hour,65+ years old,Chinese,Female,24 h
"I was with my grandchildren, playing and entertaining them with play acting activities. ",Half a day,,,,24 h
This mother's day i did save a lot. We did take-away from other eating place instead of dinning in cuisine restaurant with restriction on number of customers allow eating in. ,I'm still feeling it,,,,24 h
my neighbour gave me a bowl of soup with abalone & fish maw,A few minutes,,,,24 h
"Group conversation on WhatsApp with my 2 sis on various topics, including old penpals and covid 19 in India. ",A few minutes,,,,24 h
I completed 2 kms on the treadmill ,All day,,,,24 h
Chatting with my child on skype,I'm still feeling it,,,,24 h
When I get to be free of worries,All day,,,,24 h
I received an alert earlier,A few minutes,,,,24 h
I ate bbq which I had been craving for the past week,At least one hour,,,,24 h
,,,,,24 h
I completed my work task,A few minutes,,,,24 h
,,,,,24 h
Having to eat pizza,Half a day,,,,24 h
when i having my delicious dinner,At least one hour,65+ years old,Chinese,Female,24 h
I went out with my best friends for dinner,Half a day,,,,24 h
I felt that my crush have a feeling for me too,I'm still feeling it,,,,24 h
Baking breakfast myself.,At least one hour,,,,24 h
"Yesterday I finished watching a korean drama which was about how a man persevered in times of hardships. The ending was a good one, and it resonated well with me. I felt content and happy thinking about my own experiences.",Half a day,,,,24 h
"I was invited to a small gathering eat-out in the evening after work, was given a treat. Was pleasantly surprised too. Had not expected it. ",I'm still feeling it,,,,24 h
The day I did well for a test ,Half a day,35-44 years old,Chinese,Male,24 h
Sleeping and also playing jigsaw with my daughter,At least one hour,,,,24 h
Another happy moment in the past 24 hours was when I fuck my girlfriend and cumming in her pussy.,I'm still feeling it,,,,24 h
I had supper with my hubby last night.,At least one hour,,,,24 h
Happy that i have successfully made home made plum jam and has given a jar of jam to my neighbour and they are happy to receive it.,All day,,,,24 h
I get to eat lunch ,A few minutes,,,,24 h
"when a co-worker complimented me on a job well done, he gave me a thumb-up",Half a day,,,,24 h
My meal was ready when I reached from work.,At least one hour,,,,24 h
"I went to a shopping mall yesterday evening and bought groceries from a few shops. The shopping experience was very enjoyable, I appreciate that we could visit those places at the moment even the pandanmic is not over...",I'm still feeling it,,,,24 h
when I ate something I craved ,A few minutes,,,,24 h
When I received an offer for buying groceries online,At least one hour,65+ years old,Chinese,Female,24 h
I went home to my family,I'm still feeling it,,,,24 h
No comment on this ,Half a day,,,,24 h
Feeling contented,Half a day,,,,24 h
When i was using my newly bought laptop with my own money,I'm still feeling it,,,,24 h
nothing happy happened,A few minutes,,,,24 h
,,,,,24 h
Er cannot think of any,Other:,,,,24 h
"Another happy moment was when my friend came over and delivered my dinner, he also brought along a bottle ASEA water for me. Actually he had collected it from another friend of mine who wished to give it to me to try for free. I thanked my friend for his warming thought as the ASEA water was quite expensive.",Half a day,,,,24 h
I met a long time colleague on the MRT and have a happy and warm chat of the old days working together.,I'm still feeling it,,,,24 h
My daughter read me a story book all by herself.,I'm still feeling it,,,,24 h
,,,,,24 h
My wife prepared me my favorite food,Half a day,,,,24 h
I purchased koi,At least one hour,,,,24 h
,,,,,24 h
no happy moment,Other:,,,,24 h
completed a 10km jog,All day,,,,24 h
wife also negative swab,A few minutes,,,,24 h
"I am spending less these covid-19 pandemic, only spend on essential items. ",I'm still feeling it,,,,24 h
"I came to work earlier on in the morning, my colleague asked if i'm okay or not. Feels like someone cares for me. ",A few minutes,,,,24 h
Passed my vision test for driving license renewal. ,All day,,,,24 h
Having my favourite food at a restaurant.,Half a day,,,,24 h
My friend agree with my opinion,Half a day,,,,24 h
Medical result indicating  reasonably good health.,All day,,,,24 h
Do not have,A few minutes,,,,24 h
Eating food food's,At least one hour,,,,24 h
Timeout with my spouse,I'm still feeling it,,,,24 h
a long lost friend called me to wish me Happy Birthday,All day,,,,24 h
have a good sleep,A few minutes,,,,24 h
,,,,,24 h
alamak sad to say dont have any happy moment,Other:,,,,24 h
When my friends are getting married ,All day,,,,24 h
My garden wifh alit of flower,I'm still feeling it,,,,24 h
When Sharilyn reminded me to build my sloth mindfully.,A few minutes,,,,24 h
Another happy moment is having dinner with my mother in law and aunty,A few minutes,,,,24 h
My grandchildren ask their mom to call me and wanted to talk to me. I think they missed me.,At least one hour,55-64 years old,Chinese,Female,24 h
I ate a delicious persimmon,A few minutes,45-54 years old,Chinese,Female,24 h
my daughter is very caring nowadays.. she have grown up and more sensiable,A few minutes,25-34 years old,Chinese,Female,24 h
Another happy moment in the past 24 hours was talking to new people on social media who have similar interest as me.,At least one hour,25-34 years old,Chinese,Female,24 h
Going grocery shopping with mum,At least one hour,25-34 years old,Chinese,Female,24 h
Another happy moment in the past 24 hours was when I had a favourite snack,A few minutes,35-44 years old,Indian,Female,24 h
Another happy moment in the past 24 hours was when I was on a date,Half a day,35-44 years old,Chinese,Female,24 h
As a family singing and worshipping together ,At least one hour,45-54 years old,Chinese,Female,24 h
I had friends over for a gaming session,All day,55-64 years old,Malay,Female,24 h
My new plants are flowering.,All day,45-54 years old,Chinese,Female,24 h
Enjoying my pizza at home ,A few minutes,45-54 years old,Chinese,Female,24 h
i went out with my mom,Half a day,18-24 years old,Chinese,Female,24 h
mum cooks favourite dish,Half a day,25-34 years old,Malay,Female,24 h
I got a new speaker as a gift from a friend,At least one hour,25-34 years old,Chinese,Female,24 h
Eating meals with my whole family together ,At least one hour,35-44 years old,Malay,Female,24 h
my friend said I am very pretty.,All day,45-54 years old,Chinese,Female,24 h
I went to sleep.,A few minutes,18-24 years old,Chinese,Female,24 h
my kids having good result for her mid year exam after we put in a one month effort,All day,35-44 years old,Chinese,Female,24 h
i had my lap top repaired from virus infection,All day,NA,NA,NA,24 h
Notifed by ICA that my spouse SHN ends on 24 May,A few minutes,NA,NA,NA,24 h
"
When I won a 1st price lucky draw after having bought something from a shopping place.",I'm still feeling it,NA,NA,NA,24 h
When I am able to complete the whole course of daily exercise which usually lasted more than 60 minutes,At least one hour,NA,NA,NA,24 h
When i see growth in my career,I'm still feeling it,NA,NA,NA,24 h
I cooked lunch for my family,All day,NA,NA,NA,24 h
I managed to be able to afford a Medication that has releived some severe pain in my knee,A few minutes,NA,NA,NA,24 h
The moment when things ended without commitment ,At least one hour,25-34 years old,Chinese,Male,3m
I get to enjoy going outdoor.,All day,35-44 years old,Chinese,Female,3m
Being able to travel abroad for holidays.,All day,18-24 years old,Chinese,Male,3m
"When I get to eat the food I'm craving for, when my customers give me positive feedback.",I'm still feeling it,25-34 years old,Chinese,Female,3m
i GOT THE PROMOTION THAT i HAD BEEN EXPECTING AND I FINALKLY GOT IT,Half a day,45-54 years old,Chinese,Male,3m
Happy that my grandson get the good result,At least one hour,65+ years old,Chinese,Male,3m
I got my driving license ,All day,35-44 years old,Chinese,Male,3m
One happy moment was to have a good gathering with some friends,All day,55-64 years old,Chinese,Female,3m
I get to buy things that i always wanted,All day,35-44 years old,Malay,Male,3m
One happy moment in the past 3 months was when my son finished his Grade 1 school year and my daughter is now ready for her kindergarten. ,I'm still feeling it,35-44 years old,Other:,Female,3m
One happy moment in the past 3 months was my birthday. ,Half a day,25-34 years old,Malay,Female,3m
Won travel vouchers ,I'm still feeling it,35-44 years old,Malay,Female,3m
I got pregnant,Half a day,25-34 years old,Malay,Female,3m
I took a break for a staycation,Half a day,35-44 years old,Chinese,Female,3m
I have my family,Half a day,45-54 years old,Chinese,Female,3m
Win a lottery ,At least one hour,35-44 years old,Chinese,Male,3m
"Oit with friends, party,eat,drink, gathering 
",At least one hour,55-64 years old,Chinese,Male,3m
I sat in a bus which is largely empty.,A few minutes,35-44 years old,Chinese,Male,3m
My first born,I'm still feeling it,35-44 years old,Chinese,Male,3m
celebration of mother day,At least one hour,45-54 years old,Chinese,Male,3m
The moment we got HDB flats,All day,45-54 years old,Chinese,Male,3m
It’s been a long time since I feel happy as my situation right now is an embarrassment ,A few minutes,55-64 years old,Chinese,Male,3m
I went movie with my family.eating bbq.and going uss,Half a day,25-34 years old,Chinese,Male,3m
One happy moment in the past 3 months was when i received a gift from my brother ,All day,18-24 years old,Chinese,Male,3m
One happy moment was when I got my salary increment.,A few minutes,45-54 years old,Chinese,Male,3m
Able to celebrate my spouse's birthday together with my children.,Half a day,55-64 years old,Chinese,Male,3m
When I finally bought the bag that I have been eyeing on.,Half a day,35-44 years old,Chinese,Female,3m
Nothing in particular that make me very happy.,A few minutes,55-64 years old,Chinese,Male,3m
Found a new donut joint and bought a donut with my favourite flavour. It's so delicious that I felt happy,A few minutes,45-54 years old,Chinese,Female,3m
"unfortunatelly, nothing has made me happy in the last 3 months ",Other:,35-44 years old,Chinese,Female,3m
Hubby not as romantic compared to when we were newly wedded,At least one hour,45-54 years old,Chinese,Female,3m
My son got promotion ,I'm still feeling it,55-64 years old,Chinese,Male,3m
One I visit the zoo that day very happy moment ,All day,25-34 years old,Malay,Male,3m
I decided to finally quit my job.,All day,45-54 years old,Chinese,Male,3m
"Once I weight myself then I realise I have loss weight which made me happy.
Able to purchase online app that was very cheap compare to what you would have to pay in shop",Half a day,65+ years old,Chinese,Male,3m
"My son came up and hugged me, saying he loves me",I'm still feeling it,45-54 years old,Chinese,Male,3m
Sleeping till natural wake up,At least one hour,25-34 years old,Chinese,Female,3m
I went on a short local trip with my spouse and we had a wonderful and relaxing time,Half a day,45-54 years old,Chinese,Male,3m
"Attended school for the first time
Get graduated from high school, college or university

",All day,35-44 years old,Chinese,Male,3m
Celebrated Mother's day yesterday with all the happy moments.,All day,45-54 years old,Chinese,Male,3m
The day I completed my internship with KPMG,All day,18-24 years old,Chinese,Male,3m
Gotten a pay rise,At least one hour,55-64 years old,Chinese,Male,3m
The 4-year-old niece-in-law said I am her best friend.,At least one hour,45-54 years old,Chinese,Male,3m
"One happy moment in the past 3 months was when I was scheduled different working hours, so I won't be able to see my supervisor for 2 months.",All day,25-34 years old,Chinese,Female,3m
i managed to loose weight through intermittent  diet,I'm still feeling it,45-54 years old,Chinese,Male,3m
One happy moment was when my colleagues bought food for me and packed it for me because I was fasting.,At least one hour,18-24 years old,Malay,Female,3m
I am happy when I managed to contact my old friends  from USA which I have not met for over 25 years,All day,55-64 years old,Malay,Male,3m
I am . happy when I am exercising ,At least one hour,45-54 years old,Chinese,Female,3m
When I painted and I have done a good job at it with the amount of time spent.,At least one hour,18-24 years old,Chinese,Female,3m
One happy moment was that I managed to complete a very difficult test and passing it after a few tries. ,At least one hour,45-54 years old,Chinese,Male,3m
"one happy moment in the past 3 months is that when I sleep in for a morning. Have not sleep that well for a while... 
",Half a day,55-64 years old,Chinese,Female,3m
