moment,duration,age,race,gender,reflection
my daughter showed improved in her maths result,A few minutes,35-44 years old,Chinese,Female,24 h
People liking my post on social media.,I'm still feeling it,18-24 years old,Chinese,Female,24 h
My child cook a meal for me when I am busy with house chores.,All day,35-44 years old,Chinese,Female,24 h
"Recently, I was promoted to Sr Manager.",Half a day,65+ years old,Indian,Male,24 h
I paid a huge amount of sum to my bill to clear it off,I'm still feeling it,18-24 years old,Indian,Female,24 h
I had yummy Korean lunch.,A few minutes,25-34 years old,Chinese,Female,24 h
I spent my day off with my love one,I'm still feeling it,25-34 years old,Chinese,Male,24 h
"I had lunch with a friend and we had a deep talk about friendship, life and she gave me lots of inspirations.",Half a day,45-54 years old,Chinese,Female,24 h
When my sis cooked for me my fave food for dinner tonight.,I'm still feeling it,25-34 years old,Chinese,Female,24 h
Jeff Jeff Jeff DJ other is XX Jeff link.,At least one hour,25-34 years old,Chinese,Male,24 h
Sleeping in the night as I rarely sleep at night ,Half a day,18-24 years old,Indian,Male,24 h
Able to chant to buddah and think positive helping everyone. ,All day,55-64 years old,Chinese,Male,24 h
my grandma gave me a call because she said that it has been long since she has heard my voice.,I'm still feeling it,25-34 years old,Chinese,Female,24 h
"One happy moment in the past 24 hours was when I was alone at home, just chilling by myself",A few minutes,25-34 years old,Chinese,Female,24 h
Got a good sleep,Half a day,25-34 years old,Chinese,Male,24 h
When i finish my task in work.,A few minutes,45-54 years old,Other:,Male,24 h
When the moments with my whole family,A few minutes,25-34 years old,Chinese,Female,24 h
Happy with my granddaughter ,A few minutes,55-64 years old,Indian,Female,24 h
Strike Lottery,All day,35-44 years old,Chinese,Female,24 h
My boss approve my leave ,A few minutes,35-44 years old,Chinese,Male,24 h
I play ukulele ,All day,25-34 years old,Malay,Male,24 h
Family gathered for dinner to celebrate Mother’s Day,At least one hour,45-54 years old,Chinese,Female,24 h
I make a donation towards charity ,A few minutes,55-64 years old,Chinese,Male,24 h
Someone Girl I like  replied me and message .,Half a day,35-44 years old,Chinese,Male,24 h
the couple chatted together,All day,25-34 years old,Other:,Female,24 h
When i sold my graded Pokemon cards charizard for $1100. I was really happy and i treat my family a good meal. The rest of the money i can save up.,All day,25-34 years old,Chinese,Male,24 h
THat i am still alive today,All day,45-54 years old,Chinese,Male,24 h
"my cats follow me.when i gave them.their breakfast and dinner.they love me.so much.
the cat which i foster is now.a.beauty.sl grateful",I'm still feeling it,35-44 years old,Chinese,Female,24 h
Ate a nice meal.,A few minutes,45-54 years old,Chinese,Male,24 h
My boyfriend comforted me when I was troubled with something,At least one hour,18-24 years old,Chinese,Female,24 h
Celebrating mothers day. ,A few minutes,55-64 years old,Chinese,Male,24 h
One happy moment in the past 24 hours was when i get to spent some quality time with my husband after so long.,I'm still feeling it,25-34 years old,Malay,Female,24 h
A happy moment is when a day passes without stress.,All day,45-54 years old,Chinese,Male,24 h
"A happy moment was when I actually sat down and complete a portrait 

",At least one hour,18-24 years old,Chinese,Female,24 h
My kids bought me a beautiful mother’s day bouquet of flowers . ,I'm still feeling it,55-64 years old,Malay,Female,24 h
Nothing in particular but that I am healthy and still be able to do what I want.,All day,55-64 years old,Chinese,Male,24 h
when mum was dicharged,A few minutes,45-54 years old,Chinese,Male,24 h
"Lienent punishment meted out to our ""sovereign"" fellow citizen who consistently flouted the mask wearing rule; and secondly a group of people who confronted the Safe Distancing Ambassadors when advised against gathering with more that five people.",At least one hour,65+ years old,Chinese,Male,24 h
I knew I had a comfortable existence because I am relatively secure financially and have a caring spouse. ,A few minutes,55-64 years old,Chinese,Male,24 h
One happy moment in the past 24 hours was when I had a wholesome and enjoying family dinner.,Half a day,18-24 years old,Chinese,Male,24 h
My son cook me a dish,All day,35-44 years old,Chinese,Female,24 h
I finally decluttered a small part of the accumulated mess at home.,I'm still feeling it,35-44 years old,Chinese,Female,24 h
"One happy moment in the past 24 hours was when I talked to my girlfriend.
Another happy moment is when my investments made money",At least one hour,18-24 years old,Chinese,Male,24 h
had a date with my hubby after so long,All day,45-54 years old,Malay,Female,24 h
I spent time play with my dogs at the park,At least one hour,45-54 years old,Chinese,Male,24 h
"I did not experience any side effects from my 2nd vaccine dose!  I was merely sleepy, which is such relief for me!",All day,55-64 years old,Chinese,Female,24 h
I managed to paint my room.,At least one hour,25-34 years old,Malay,Male,24 h
When I bought my self a chocolate,A few minutes,25-34 years old,Chinese,Female,24 h
Attending online church service on sunday. Found it comforting and a nice sunday routine.,All day,55-64 years old,Chinese,Male,24 h
My children expressed their gratitude to my wife and wish her happy mother's day.,A few minutes,55-64 years old,Chinese,Male,24 h
"5 Gallop strengths are 1. Activator, 2. Communication, 3. Restorative, 4. Positivity, & 5. Includer. There are times, I talk too much, but after my stroke, I learned to be much understanding and be aware of others' needs. That makes me Happy.",All day,55-64 years old,Chinese,Male,24 h
God answers my prayers,All day,45-54 years old,Chinese,Female,24 h
I'm happy have happily married and family. ,I'm still feeling it,45-54 years old,Chinese,Male,24 h
When I see my wife,A few minutes,45-54 years old,Chinese,Male,24 h
"Yesterday is Mother’s Day, on that moment I felt happy that in this COVID-19 
situation, all of my family members are healthy and had chance to gathering 
together ",At least one hour,45-54 years old,Chinese,Female,24 h
I clean my house which I thought i wont have the time. Ive done preparation for hari raya which I thought i won’t be celebrating.,I'm still feeling it,25-34 years old,Malay,Female,24 h
I helped my good friend solve a difficult relationship problem. The couple subsequently thank me for enlightening them and treat me to a meal which I gladly accepted,All day,45-54 years old,Chinese,Male,24 h
I help a college who fall and hurt his head and need to send to hospital for treatment ,All day,65+ years old,Chinese,Male,24 h
"One happy moment in the past 24 hours was when I treated myself to a meat platter consisting of roast duck, roast pork and char siew with rice. It was a fulfilling meal and it made me happy.",Half a day,45-54 years old,Chinese,Male,24 h
One happy moment in the past 24 hours was when i saw the BTS teaser photo. ,All day,25-34 years old,Chinese,Male,24 h
away from Singapore in a natural nation with lesser people,I'm still feeling it,45-54 years old,Chinese,Male,24 h
One happy moment in the past 24 hours was when I had a staycay with my partner. It was fun.,All day,18-24 years old,Chinese,Female,24 h
WIth my mother,I'm still feeling it,45-54 years old,Chinese,Female,24 h
"I have not experienced any moment which made me happy. We are in the midst of a pandemic, how happy can we be?",A few minutes,55-64 years old,Chinese,Female,24 h
I celebrated Mother’s Day yesterday with my love ones.,Half a day,45-54 years old,Chinese,Female,24 h
When I saw a good bargain on an e-commerce platform.,I'm still feeling it,55-64 years old,Chinese,Male,24 h
One happy moment in the past 24 hours was when i found out that I've finally pass my driving licence after the 4th attempt.,I'm still feeling it,45-54 years old,Chinese,Female,24 h
One happy moment in the past 24 hours was when my order for a Nintendo Switch arrived.,At least one hour,18-24 years old,Malay,Female,24 h
I look forward weekend because it is family day,All day,45-54 years old,Chinese,Male,24 h
when my children ask me about my health,A few minutes,65+ years old,Chinese,Male,24 h
When I am with myfamily,At least one hour,18-24 years old,Chinese,Female,24 h
I was making sushi and sandwiches with my girlfriend,Half a day,18-24 years old,Chinese,Male,24 h
Receiving money from a debtor,A few minutes,25-34 years old,Chinese,Female,24 h
"I finish my run. 
",All day,18-24 years old,Chinese,Male,24 h
"Video calling my wife during my lunch break at work.
",I'm still feeling it,25-34 years old,Chinese,Male,24 h
Was when my children wish me a happy mothers day and a small token of appreciation. Feeling appreciated. ,A few minutes,55-64 years old,Malay,Female,24 h
One happy moment in the past 24 hours was when I managed to help my friend with a task that he was working on.,A few minutes,45-54 years old,Chinese,Male,24 h
Not much work to be done ,Half a day,45-54 years old,Chinese,Male,24 h
One happy.moment was when my.son did well in his math test,All day,45-54 years old,Chinese,Female,24 h
I stepped away from my work cubicle after a 10-hour long shift doing work I had no interest in but was merely tolerating for the pay,A few minutes,55-64 years old,Chinese,Male,24 h
Having made a difference to other's life through volunteering.,I'm still feeling it,45-54 years old,Chinese,Male,24 h
Upon successful projects done.,At least one hour,55-64 years old,Chinese,Male,24 h
"Went for a long trail walk with my daughter yesterday for Mother's Day
",All day,45-54 years old,Chinese,Female,24 h
Spend the whole day with a close friend of mine to dissolve his problem ,Half a day,45-54 years old,Chinese,Male,24 h
No I was so depressed these days,Other:,35-44 years old,Chinese,Female,24 h
Playing with my son,A few minutes,45-54 years old,Chinese,Female,24 h
"I celebrated Mother's Day with my mum, siblings and my daughters.",At least one hour,45-54 years old,Chinese,Female,24 h
I have completed a 2 days course,Half a day,45-54 years old,Chinese,Male,24 h
I managed to bake a butter cake on my own without my mother's help.,At least one hour,45-54 years old,Chinese,Female,24 h
"Happy to see my twin grand-nieces growing taller, playful, getting to know words, speaking intelligently.",I'm still feeling it,55-64 years old,Chinese,Male,24 h
The happiest monent was our first holiday together as a married couple to UK.,At least one hour,55-64 years old,Chinese,Female,24 h
my dad gave me my first dog. ,I'm still feeling it,55-64 years old,Chinese,Female,24 h
I saw a lost 5 year old girl in tears in the hypermart and lead her to the Customer Service counter where she reunited with her mother,At least one hour,45-54 years old,Chinese,Female,24 h
Having dinner with my family ,I'm still feeling it,55-64 years old,Chinese,Male,24 h
i buy sales item.,A few minutes,55-64 years old,Chinese,Female,24 h
Able to mingle fantastically well with customers,All day,45-54 years old,Chinese,Female,24 h
I am happy that I was able to go out on Sunday with my friends as I have been confined at home as my mum was not well since March 2021.,Half a day,45-54 years old,Chinese,Male,24 h
One happy moment in the past 24hours is spending time with my bf playing game ,All day,18-24 years old,Chinese,Female,24 h
i was able to fall in sleep on time and gain enough sleep over the weekend.,At least one hour,25-34 years old,Chinese,Male,24 h
The dinner food bought was better than expected.,A few minutes,45-54 years old,Malay,Male,24 h
one happy moment in the past 24 hours was when my friend celebrated my birthday and gave me a birthday present,I'm still feeling it,18-24 years old,Chinese,Male,24 h
Playing with partner,At least one hour,45-54 years old,Chinese,Female,24 h
"I made love to a beautiful lady
I tasted the best wine",All day,45-54 years old,Chinese,Male,24 h
I managed to successfully profit from my Bitcoin online trades.,All day,25-34 years old,Malay,Male,24 h
Spending quality time with the family. ,Half a day,55-64 years old,Chinese,Male,24 h
"i dont think i had a happy moment in the past 24 hours except maybe when i was eating snacks. but is that really happiness? its just food, and i ate too much.",A few minutes,18-24 years old,Chinese,Female,24 h
"Life isn't that bad, with friends and my families along",A few minutes,45-54 years old,Chinese,Male,24 h
Getting out of the house for an unscheduled evening walk,At least one hour,55-64 years old,Chinese,Male,24 h
funny way of talking by son,A few minutes,45-54 years old,Chinese,Male,24 h
the day I make my early retirement come true,I'm still feeling it,65+ years old,Chinese,Female,24 h
Spending the whole day lazing in bed and watching drama,All day,18-24 years old,Chinese,Female,24 h
none I can think of,Other:,55-64 years old,Chinese,Male,24 h
My husband wants a cuddle and loving moment with me after work.,I'm still feeling it,25-34 years old,Malay,Female,24 h
I have learned how to make my ice cream and also very happy that I am also successful make my own jam for daily breakfast spread.,At least one hour,55-64 years old,Chinese,Female,24 h
My health continues to be healthy ,All day,55-64 years old,Chinese,Male,24 h
I received some pleasant photos of overseas friends hiking in a natural setting.,A few minutes,55-64 years old,Other:,Male,24 h
My wife got accepted in a masters programme.,Half a day,45-54 years old,Other:,Male,24 h
my crush kissed me ,All day,18-24 years old,Chinese,Female,24 h
when i get married and delivered my child successfuly,I'm still feeling it,25-34 years old,Other:,Female,24 h
I finished a tiring event that i have been planning for over 1 year.,A few minutes,18-24 years old,Chinese,Male,24 h
I am happy that I am still alive and I am able to do any activities with good health and mobility...,I'm still feeling it,55-64 years old,Chinese,Female,24 h
Having the good moments in time with friends as well as family.,I'm still feeling it,45-54 years old,Malay,Male,24 h
To complete my house work and have time to rest,I'm still feeling it,55-64 years old,Chinese,Female,24 h
Completed a 10km run last evening and was happy about it. Likely due to the endorphins released.,At least one hour,55-64 years old,Chinese,Male,24 h
Recently my niece invited me to a movie. I am happy and look forward to it as ii have not seen a movie for a few years. ,All day,55-64 years old,Chinese,Female,24 h
My boss praised me for doing a good job at work. ,A few minutes,45-54 years old,Chinese,Male,24 h
"My daughter coming up with jokes
Called for an interview ",I'm still feeling it,45-54 years old,Indian,Female,24 h
One happy moment when my application for course is successful,At least one hour,45-54 years old,Chinese,Female,24 h
"Chatting in the car with my son and hubby,little jokes made me happy and contented.",All day,45-54 years old,Chinese,Female,24 h
Cant remember,A few minutes,65+ years old,Chinese,Female,24 h
"I received a new photo of a friends child, whom we love. Very happy to see him in a naughty mood.",I'm still feeling it,65+ years old,Indian,Male,24 h
mother day celebration for me,Half a day,45-54 years old,Chinese,Female,24 h
"Met up with good old friends and enjoying few glasses of beer, recollecting happy moments during our younger days.",Half a day,55-64 years old,Chinese,Male,24 h
cannot recall any,Other:,45-54 years old,Chinese,Female,24 h
My wife and kids joked and fool around with me just before bedtime.,At least one hour,45-54 years old,Chinese,Male,24 h
"First moment:
The very first moment in the past 24 hours was when in coincide with Mother's Day...We got a very very suprised message from my only daughter that she is expecting another child. Truly A Blessing! Amiin...🙏",I'm still feeling it,55-64 years old,Other:,Male,24 h
My most happy moments for the past 24 hours is the feel of having a intimidating together-ness with romantic feeling.,I'm still feeling it,55-64 years old,Chinese,Male,24 h
One happy moment in the past 24 hours was when eating my favorite ice-cream while watching TV.,A few minutes,45-54 years old,Chinese,Female,24 h
Grandson came to visit me,All day,65+ years old,Chinese,Male,24 h
"First event happened yesterday, was the first time my daughter treat me a mother's day dinner.",I'm still feeling it,45-54 years old,Chinese,Female,24 h
I know I have control over my health.,I'm still feeling it,55-64 years old,Chinese,Male,24 h
"MY SON'S WEDDING WHICH WAS HELD RECENTLY. DESPITE THE PANDEMIC, HE MANAGED TO PULL IT OFF BESUTIFULLY. ",All day,55-64 years old,Chinese,Male,24 h
Able to match the buyer n seller requirements for small transaction to move forward,I'm still feeling it,65+ years old,Chinese,Female,24 h
I strike 4D in yesterday's draw,All day,55-64 years old,Chinese,Male,24 h
Reading an article relating to a charitable act by a common citizen,A few minutes,45-54 years old,Chinese,Female,24 h
when celebrating a birthday with the whole family,Half a day,55-64 years old,Chinese,Male,24 h
When everything goes as plan with no hiccups and disasters,Half a day,65+ years old,Chinese,Female,24 h
One happy moment in the past 24 hours was when I enjoyed a shared meal with 4 other friends who also like spicy food.,I'm still feeling it,25-34 years old,Chinese,Female,24 h
"I had Korean for lunch, I got my proposed FYP",At least one hour,18-24 years old,Chinese,Female,24 h
When my children wish me happy mother’s day,A few minutes,45-54 years old,Chinese,Female,24 h
Happy and contented ,I'm still feeling it,45-54 years old,Chinese,Male,24 h
One happy moment in the past 24 hours was when I saw my son sleeping peaceful.,I'm still feeling it,25-34 years old,Malay,Female,24 h
Good bonding time with my sons on Mother's Day.,All day,55-64 years old,Chinese,Female,24 h
No happy moments last 2 days,Other:,45-54 years old,Chinese,Female,24 h
Sunday worship service,Half a day,45-54 years old,Chinese,Female,24 h
my boy spoke at length with me about something he enjoyed very much.,At least one hour,45-54 years old,Chinese,Male,24 h
When I was at my grandma house spending time with her. she remembered things that she have already forgotten and that made me very happy,I'm still feeling it,18-24 years old,Indian,Female,24 h
earn reward from survey ,All day,55-64 years old,Chinese,Male,24 h
The day my daughter graduation at NUS. I get my bonus last month. ,All day,55-64 years old,Chinese,Male,24 h
"Every moment is happy, not just one or two occasions. so can't really name a few...",I'm still feeling it,45-54 years old,Chinese,Male,24 h
I went for our usual relaxing Sunday walk with my kids. We recce the Chestnut trial and had lunch at Subway after the walk. It was Mother's Day and my kids randomly wished my. I like that there was no effort put in but it came straight from their hearts whilst we were eating. ,I'm still feeling it,45-54 years old,Chinese,Female,24 h
I am happy and contented that my children have grown up and able to care for their family.,I'm still feeling it,65+ years old,Chinese,Male,24 h
Having lunch with my family.,At least one hour,18-24 years old,Chinese,Male,24 h
knowing a friend has solve his problem,At least one hour,65+ years old,Chinese,Female,24 h
"One happy moment in the past 24 hours was when I went out with my friends for a meal because Covid-19 has limited outings and venues for enjoyment, so every moment with friends is more special than before.",At least one hour,55-64 years old,Other:,Male,24 h
Watching my 1-year old grandson take his first step (unsupported) ,At least one hour,55-64 years old,Chinese,Female,24 h
the family celebrated mothers day for me. They showered me with lots of love. Really appreciate that moment of surprise. ,I'm still feeling it,65+ years old,Chinese,Female,24 h
I had good with 2 friends we go swimming ,I'm still feeling it,55-64 years old,Chinese,Female,24 h
With my grandson ,At least one hour,55-64 years old,Chinese,Male,24 h
When I won first place in an online game.,A few minutes,18-24 years old,Chinese,Female,24 h
I saw a little mynah on a grass patch chirping loudly and seeming to enjoy the sun.,A few minutes,55-64 years old,Chinese,Female,24 h
things went in my favour and in quick time.,A few minutes,55-64 years old,Chinese,Male,24 h
I was able to make a deal to someone,A few minutes,45-54 years old,Chinese,Male,24 h
One happy moment in the past 24 hours was when Chelsea won against Manchester City in the final minutes. I won some money.,All day,18-24 years old,Chinese,Male,24 h
I managed to get my court booking.,A few minutes,55-64 years old,Chinese,Male,24 h
My happy moment is when my students asked why I did not come in to teach them on one of the days.,Half a day,45-54 years old,Other:,Female,24 h
One happy moment in the past 24 hours was when I woke up early enough to eat breakfast with my parents. ,All day,18-24 years old,Chinese,Female,24 h
When my 2 boys prayed together with me.,A few minutes,45-54 years old,Other:,Female,24 h
Met my favourite Supermarket staff while shopping. ,At least one hour,55-64 years old,Chinese,Male,24 h
 WHENEVER I RECEIVED NEWS OF ANY ABSENTED FAMILY MEMBERS I BECAME EXCITED AND HAPPY WITHIN ME.,I'm still feeling it,65+ years old,Chinese,Female,24 h
Getting my chores done,At least one hour,45-54 years old,Chinese,Female,24 h
i can get the peace i want and everyone near me is also enjoying the joy and happiness I am going through,I'm still feeling it,45-54 years old,Chinese,Male,24 h
My daughter returned safely from a 15_day conservation trip. It was a hardship tour with little resources on the island off Western Australia. ,Half a day,55-64 years old,Chinese,Female,24 h
Getting a new job,I'm still feeling it,45-54 years old,Chinese,Male,24 h
my children looked so happy doing a selfie with me celebrating mother's day with a cake !,All day,65+ years old,Chinese,Female,24 h
The weekend starts,All day,45-54 years old,Chinese,Male,24 h
No moment of happiness,A few minutes,45-54 years old,Chinese,Female,24 h
One happy moment in the past 24 hours was texting my sister,At least one hour,45-54 years old,Chinese,Female,24 h
I had my favourite food,At least one hour,18-24 years old,Chinese,Female,24 h
I received a bouquet of flowers and lovely design cake and a deebot vacuum cleaner on mothers day,All day,55-64 years old,Malay,Female,24 h
"I had a fun session with my 3 nephews, all in their late teens when I bought a yogurt drink with was contained in a milk feeding bottle.  They had a good laugh as they tried to recall the last time they used it to drink it was when they were still toddlers. ",I'm still feeling it,45-54 years old,Chinese,Female,24 h
When I prayed to God and felt that nothing is lost.,I'm still feeling it,45-54 years old,Indian,Male,24 h
: taking care of my two grandaughters.,Half a day,65+ years old,Chinese,Female,24 h
"I work part time care assistant in hospital, it's very good feeling when your patients recover and go home. Life move on then",A few minutes,55-64 years old,Chinese,Male,24 h
I was quite happy when I received my 3rd year undergraduate results in that I did extremely well,I'm still feeling it,18-24 years old,Chinese,Male,24 h
Celebrating Mother’s Day with my family. ,I'm still feeling it,55-64 years old,Chinese,Female,24 h
"One happy moment in the past 24 hours was when I completed all my tasks for the day. I think that whenever I manage to be on task and submit everything that I have to do, I don't just feel a sense of relief, but also some happiness that comes along with it.",I'm still feeling it,18-24 years old,Chinese,Female,24 h
Cooking for my family,At least one hour,45-54 years old,Chinese,Male,24 h
"Had been working, have not felt happy moment yet.",Other:,45-54 years old,Chinese,Male,24 h
Seeing the post of my cute grandson in my daughter in law's I tangram ,At least one hour,55-64 years old,Chinese,Female,24 h
One happy moment is when my dad is feeling better.,At least one hour,45-54 years old,Chinese,Male,24 h
The day I graduated from school,All day,45-54 years old,Chinese,Female,24 h
When I learned that I dont have work in the morning for the last 3 days of the week.,A few minutes,55-64 years old,Chinese,Female,24 h
I made some money from crypto trading.,Half a day,25-34 years old,Chinese,Male,24 h
I was praised by my boss,At least one hour,55-64 years old,Chinese,Female,24 h
i was able to sing karaoke at home,All day,25-34 years old,Chinese,Male,24 h
When things goes smoothly as planned,A few minutes,45-54 years old,Chinese,Male,24 h
"one happy moment in the past 24 hours was, a mother's day treat from Amanda Lee.",All day,65+ years old,Chinese,Female,24 h
I could clear some candies on my phone.,A few minutes,45-54 years old,Chinese,Male,24 h
30 minutes ago I was very happy that my son was able to do his Chinese spelling without any error.,At least one hour,45-54 years old,Chinese,Male,24 h
When I successfully made lemon curd and almond butter at home. ,At least one hour,25-34 years old,Chinese,Female,24 h
My investment are doing well. ,At least one hour,45-54 years old,Chinese,Female,24 h
Today when i went to a game cafe to play console games with my friends.,Half a day,18-24 years old,Chinese,Male,24 h
The day I bacomes a father,All day,45-54 years old,Chinese,Male,24 h
won a game.,At least one hour,18-24 years old,Chinese,Male,24 h
"While I was deep sleep my son and grandchildren came to my room and wish me Happy Mother's day, hugging me and give kiss. Each one of them they extended their love and brought their gifts to me",All day,55-64 years old,Indian,Female,24 h
I watched a funny Indian movie,At least one hour,55-64 years old,Chinese,Female,24 h
I am exercising ,At least one hour,55-64 years old,Chinese,Female,24 h
